,address,company,conditions,date,description,duty,experience,name,requirements,salaryMAX,salaryMIN,schedule,skills,type_of_employment,url
685,Челябинск,Компьютерная компания,,14 октября 2020," Давайте познакомимся: Наша компания основана в 1992 году . Мы первыми в Челябинске начали продавать программы “1С”. Кроме программ наша компания продает и услуги программистов 1С. Мы ищем менеджера по продажам на постоянную работу (как с опытом, так и без опыта работы).Возможна и удаленная работа на полный рабочий день. Идеальный кандидат для нас: настойчивый способный упорно работать и много учиться кому часто везет кто умеет слушать Наши ценности: Мы ценим сотрудников за результаты Мы любим, когда работа делается быстро Мы любим учиться и использовать самое передовое и дающее хороший результат Мы стремимся к тому, чтобы клиент получил то, что мы обещали и даже немного больше Мы ценим соблюдение правил компании Мы за уважительное отношение сотрудников друг к другу и к клиентам Мы гордимся, когда сотрудники «растут» в компании и становятся супер профессионалами и (или) руководителями Данные про нас: В нашей компании работает 42 человека Примерно 50 процентов сотрудников работают в компании более 10 лет. Мы заключаем каждый год более 1100 договоров ежемесячного сопровождения по 1С. Ваши обязанности: Обработка входящих заявок от клиентов Работа на исходящих звонках Общение с клиентами Заключение сделок Ведение клиентской базы Предложение своих идей по улучшению технологии продаж Что Вы получите? Прозрачную систему оплаты (процент от продаж) Зарплату, которая зависит только от личного результата в продажах. «Потолка» в зарплате нет. Выплату зарплаты раз в неделю Четкие правила работы Много обучения ( и не только в начале работы) Регулярные тренировки по продажам Опытного наставника Обучение нашему продукту Обучение технике продаж Помощь от других менеджеров по продажам Возможность проявить все свои таланты Соревнование между менеджерами по продажам (с призами победителям) Возможность стать руководителем отдела продаж в течение первого года работы Поддержку от отдела маркетинга и рекламы Когда Вы сможете начать работу? Через 1 день после собеседования И теперь, если Вы внимательно прочитали вакансию и хотите с нами работать, заполните анкету! ",,не требуется,Менеджер по продажам,,80000.0,20000.0,полный день,"Ведение переговоров,Пользователь ПК,Управление продажами,Активные продажи,Холодные продажи,Грамотная речь,Поиск и привлечение клиентов,Навыки продаж,Прямые продажи,Навыки работы с возражениями,Работа с возражениями,Холодные звонки,Знание 1С,исходящие звонки,Организация встреч,B2B Продажи,Заключение договоров,Телефонные переговоры",Полная занятость,https://tyumen.hh.ru/vacancy/39228578
379,Челябинск,ГудВорк,,29 сентября 2020," Обязанности: Строительство базовых станций сотовой связи. Установка и обслуживание оборудования на объектах сотовой связи. Работа круглый год. Требования: Монтаж металлоконструкций, базовые навыки по электричеству, промышленный альпинизм. Условия: Профильным специалистам - особые условия. Работа круглый год и много. Возможно обучение. ",,не требуется,Монтажник (промышленный альпинизм),,80000.0,27000.0,полный день,"Пользователь ПК,Монтаж оборудования,Turbo Pascal,Расстановка приоритетов,MS Dos",Полная занятость,https://tyumen.hh.ru/vacancy/39524239
50,Челябинск,Некстайп,,15 октября 2020," Хочешь продавать классный продукт и развиваться в сфере IT? Тогда ты наш кандидат! Мы крутая веб-студия, которая развивается и масштабируется постоянно. Мы всегда рады новым талантам, а самое главное готовы обучать! Наши клиенты находятся по всей территории РФ и СНГ. Мы работаем с такими компаниями как: Nutricia, Heinz Baby, Coral Travel, Metro CC и с рядом других, крупных, известных брендов. Что ты получишь от нас: Клиенты -Мы предоставляем клиентскую базу, это те клиенты, которые знают про нас и уже приобретали наши готовые решения. Твоя задача, работать с данными клиентами и осуществлять полный цикл продаж наших готовых решений или услуг по оптимизации сайта. Рост и развитие - Наши менеджеры это высококлассные эксперты своего дела. Мы за постоянное обучение, за закрепление знаний на практике. Непрерывный обмен информации внутри отдела продаж, а так же среди всех наших отделов! Мы готовы оплачивать конференции, митапы и выставки. Проекты - Наши проекты-наша гордость. Мы создаем готовые решения с 0( интернет-магазины, корпоративные сайты) Разрабатываем сайты для клиентов, и конечно же продвигаем. Работаем в направлении b2b, охватываем всю территорию РФ и страны СНГ. На нашем сайте ты увидишь реализованные проекты для наших клиентов. Команда -Молодой, активный и дружный коллектив. С тобой будут трудиться бок о бок разработчики, интернет-маркетологи, творческие веб-дизайнеры. Что мы ждем от тебя: Опыт работы в продажах , даже если ты работал только с физ лицами, но готов обучаться не покладая рук, откликайся! Уверенность в результате , главное для продаж, это результат и довольный клиент. В твоем опыте должны быть такие сделки, расскажи нам о них! И покажи на деле. Энергия , много энергии. Без нее продаж не получится. Позитивный настрой , главное оружие менеджера! Бонусом будет, если у тебя был опыт работы с исходящими звонками! Откликайтесь на вакансию, мы всегда рады пообщаться с талантливыми и интересными людьми! ",,1–3 года,Менеджер по продажам (IT-продукты),,80000.0,30000.0,полный день,"1С-Битрикс,Холодные продажи,Контекстная реклама,Интернет-реклама,B2B Продажи,Ведение переговоров,Клиентоориентированность,Ведение клиентской базы,Навыки продаж,Активные продажи,Холодные звонки,Работа с возражениями,Ведение активных клиентов,Поиск и привлечение клиентов",Полная занятость,https://tyumen.hh.ru/vacancy/39339140
513,Челябинск,Флексайтс,,8 октября 2020," Требования: Знание PHP Знание Bitrix Framework (БУС и Битрикс24), в частности D7 и ORM Знание WordPress Знание SQL и основ построения баз данных Понимание принципов ООП и умение применять их Умение разрабатывать и использовать REST API Умение работать с Git Опыт работы с Linux Желание учиться новому и не бояться трудностей. Условия: Работа с 9-00 утра до 18-00 (или до выполнения). На период стажировки и обучения - оклад по договорённости. В дальнейшем - сдельная зарплата (в среднем от 30000 до 80000). Уютный офис, дружный творческий коллектив. Чай, кофе за счет заведения. О компании: Компания ""Флексайтс"" на рынке с 2002 года, занимаемся разработкой, продвижением и сопровождение сайтов. В портфолио сложные тендерные площадки (Равис, СоюзПищеПром и др.), серьезные интернет-проекты (УралПромБанк, Фианит-Ломбард и др.) Ищите наш сайт в интернете. Заходите, анализируйте, насколько мы с вами друг другу подходим. Почувствуете, что ""это моё"" - пишите, звоните, не стесняйтесь! Будем рады знакомству в любом случае. ",,1–3 года,"Веб-программист - MIDDLE - со знанием php (Битрикс, WordPress)",,80000.0,30000.0,полный день,"Git,Linux,CMS Wordpress,ООП,PHP,1С-Битрикс",Полная занятость,https://tyumen.hh.ru/vacancy/39699239
608,Челябинск,Факт,"Высокая заработная плата с ежегодной компенсацией;,Официальное трудоустройство по ТК РФ;,Возможность реализовывать крупные, высоконагруженные проекты в большой команде,Работа с использованием новейших программных продуктов и технологий,Дружная команда профессионалов в пяти офисах по стране.",1 октября 2020," Факт - лидер рынка веб-разработки. Работаем с крупнейшими российскими федеральными компаниями и представительствами крупных зарубежных компаний в России. Наши заказчики - такие известные бренды, как ПАО ""Туполев"", Технониколь, Русал, Гознак, Адамас, Paolo Conte, Gold 585, Интер РАО ЕЭС и другие. Профиль нашей компании - создание, сопровождение и развитие технологичных веб-систем. Мы ищем менеджеров с опытом работы в сфере ИТ и опытом внедрения систем на платформе Битрикс 24 . Рост в компании . Сотрудники вырастают в профессиональном, карьерном, финансовом уровне. Что делать: Сбор функциональных требований у заказчика: понимание бизнес-процессов, которые можно улучшить с Битрикс24; Написание ТЗ для программистов для создания кастомизированных решений; Внедрение Битрикс24 у клиентов, включая интеграцию с внешними системами; Написание методической документации, регламентов; Обучение и консультирование пользователей; Сдача работ заказчику; Оценка проектов по срокам; · Контроль качества выполняемых работ: сроки, качество, полнота и соответствие требованиям реализованного функционала; Управление проектными рисками. Что уметь: Опыт работы на проектах внедрения Битрикс24 от 1 года; Знание и понимание бизнес-процессов клиентов в разных отраслях; Глубокое понимание функционала системы Битрикс24; Опыт формализации требований заказчика к системе и создания схем бизнес-процессов; Наличие сертификатов Битрикс24 будет преимуществом; Условия: Высокая заработная плата с ежегодной компенсацией; Официальное трудоустройство по ТК РФ; Возможность реализовывать крупные, высоконагруженные проекты в большой команде Работа с использованием новейших программных продуктов и технологий Дружная команда профессионалов в пяти офисах по стране. Окончательное решение по размеру заработной платы принимается на основании анализа релевантного опыта работы кандидата в сфере ИТ, опыта внедрения систем на платформе Битрикс 24 и по результатам проведенных собеседований. ",,1–3 года,Менеджер проектов (Битрикс24),,80000.0,40000.0,полный день,"Обучение персонала,Бизнес-анализ,Обучение и развитие,Проведение тестирований,Организационное консультирование,Битрикс24",Полная занятость,https://tyumen.hh.ru/vacancy/38943742
758,Челябинск,POP&POPL (ИП Попова Екатерина Игоревна),"График работы свободный, главное быть всегда на связи и решать проблемы по мере необходимости;,Официальное трудоустройство;,Работа в стабильной развивающейся компании.",15 октября 2020," Обязанности Обеспечение непрерывной бесперебойной работы розничных магазинов, интернет-магазина, сервера, кассовых аппаратов, видеонаблюдения, всех компьютеров (10 шт), чековых принтеров, POS-терминалов и т. включая магазин в городе Казань; Выявление и исправление ошибок в учете/коде; Участие в инвентаризации; Работа с 1с, интеграция с сайтом, контроль; Разработка, подготовка необходимой документации для подрядчиков; Развитие IТ-систем с учетом общей стратегии бизнеса; Выявление потребностей бизнеса в части информационных технологий, оценка возможностей и внедрение новых IТ-решений; Диагностика и ремонт ПК, оргтехники, торгового оборудования. Требования: Опыт работы в аналогичной должности (розничные продажи) связанной с IТ-поддержкой; Обязательное знание 1С; Опыт работы с техникой розничных магазинов (POS терминалы, кассовые аппараты, чековые принтеры, видеонаблюдение и т.д); Настройка и устранение неисправностей вышеперечисленной техники; Базовые знания серверного и коммутационного оборудования; Опыт работы с внешними поставщиками IТ сервисов. Условия: График работы свободный, главное быть всегда на связи и решать проблемы по мере необходимости; Официальное трудоустройство; Работа в стабильной развивающейся компании. ",,3–6 лет,Специалист по IT,"Опыт работы в аналогичной должности (розничные продажи) связанной с IТ-поддержкой;,Обязательное знание 1С;,Опыт работы с техникой розничных магазинов (POS терминалы, кассовые аппараты, чековые принтеры, видеонаблюдение и т.д);,Настройка и устранение неисправностей вышеперечисленной техники;,Базовые знания серверного и коммутационного оборудования;,Опыт работы с внешними поставщиками IТ сервисов.",80000.0,40000.0,гибкий график,"1С-Битрикс,1С: CRM ПРОФ,CRM Мегаплан,MS CRM",Полная занятость,https://tyumen.hh.ru/vacancy/39838469
