,address,company,conditions,date,description,duty,experience,name,requirements,salaryMAX,salaryMIN,schedule,skills,type_of_employment,url
639,Челябинск,Profit Center,,6 октября 2020," Требуемый опыт работы: 3–6 лет Полная занятость, удаленная работа За домашним монитором или в уютном офисе, вы с первого дня ощутите теплую и дружественную атмосферу командной работы в нашей компании. Компания Profit Center это: Создание IT продуктов под реальные потребности рынка Команда сформированная по принципу общих ценностей Многолетняя компетенция в предметной области Налаженный процесс ввода в должность сотрудников Текучка кадров по году меньше 5% Оплата овертаймов Свобода в выборе рабочего времени и места Удовольствие от профессионального роста и командной работы И мы ищем в наше команду опытного, умного, инициативного и педантичного Web-разработчика. Основные функции: Участие в разработке ПО для работы на финансовых рынках Написание десктопных/серверных приложений на C# Оптимизация кода Минимизация задержек в передаче и обработке данных Необходимые навыки: Опыт разработки от 3х лет на C# Отличное понимание ООП Опыт построения многопоточных приложений Умение разбираться в чужом коде, писать качественный, быстрый и понятный код Способность быстро учиться и работать самостоятельно Уровень английского не важен Компания предлагает: Вилка по заработной плате - 1000 - 1800 USD Удаленную занятость на полный рабочий день с гибким графиком Участие в разработке масштабного продукта компании Не простой кодинг, а решение уникальных задач Нацеленность на результат, а не на процесс Индивидуальный подход к каждому разработчику Возможность профессионального и карьерного роста Все не опишешь двумя словами, но если заинтересовала - высылайте резюме!) В сопроводительном письме укажите, пожалуйста, желаемый уровень дохода. ",,3–6 лет,.NET developer,,2000.0,1200.0,полный день,"ООП,C#,.NET Framework",Полная занятость,https://tyumen.hh.ru/vacancy/39664089
446,Чебаркуль,Компания ТрансТелеКом,,12 октября 2020," Мы растем и ищем сотрудника в молодую и дружную команду. Мы предоставляем качественные услуги связи населению нашего города, с нами выгодно, потому что мы магистральный провайдер, наши клиенты довольны, и рекомендуют нас друзьям и соседям. В связи с расширением , компания ТТК , один из ведущих операторов связи ищет менеджера по продажам. Мы предлагаем: Доход от 15 000 , без потолка Доп. премии за объем продаж Организация удаленного рабочего места Обучение, наставничество График работы выбирается индивидуально (подработка, возможность совмещать с учебой) Возможности проявить себя в конкурсах с ценными призами Вместе с нашей командой ты будешь: Консультировать клиентов об услугах компании (интернет, интерактивное телевидение, мобильная связь); Оформлять заявки на подключение Развиваться и создавать свою историю успеха Если ты общительный, активный и энергичный, мы ждем тебя на собеседовании! Помни, опыт работы не имеет значения! Мы научим всему, что тебе необходимо, чтобы стать успешным! Начни карьеру в надежной, стабильной компании! Если у тебя не так много опыта, но ты чувствуешь, что можешь достичь успеха – откликайся на нашу вакансию! ",,не требуется,Оператор Call-центра / Контакт центра (Удаленно),,17000.0,15000.0,удаленная работа,"Активные продажи,Холодные продажи",Частичная занятость,https://tyumen.hh.ru/vacancy/39317387
621,Сатка,Компания ТрансТелеКом,,12 октября 2020," Мы растем и ищем сотрудника в молодую и дружную команду. Мы предоставляем качественные услуги связи населению нашего города, с нами выгодно, потому что мы магистральный провайдер, наши клиенты довольны, и рекомендуют нас друзьям и соседям. В связи с расширением , компания ТТК , один из ведущих операторов связи ищет менеджера по продажам. Мы предлагаем: Доход от 15 000 , без потолка Доп. премии за объем продаж Организация удаленного рабочего места Обучение, наставничество График работы выбирается индивидуально (подработка, возможность совмещать с учебой) Возможности проявить себя в конкурсах с ценными призами Вместе с нашей командой ты будешь: Консультировать клиентов об услугах компании (интернет, интерактивное телевидение, мобильная связь); Оформлять заявки на подключение Развиваться и создавать свою историю успеха Если ты общительный, активный и энергичный, мы ждем тебя на собеседовании! Помни, опыт работы не имеет значения! Мы научим всему, что тебе необходимо, чтобы стать успешным! Начни карьеру в надежной, стабильной компании! Если у тебя не так много опыта, но ты чувствуешь, что можешь достичь успеха – откликайся на нашу вакансию! ",,не требуется,Оператор Call-центра / Контакт центра (Удаленно),,17000.0,15000.0,удаленная работа,"Активные продажи,Холодные продажи",Частичная занятость,https://tyumen.hh.ru/vacancy/39743790
83,Челябинск,Первый Гипермаркет Мебели,,15 октября 2020," А знали ли Вы, что каждый посетитель нашего интернет - магазина видит результат работы контент-менеджера! Теперь в нашем контент - отделе 2 новые вакансии в связи с добавлением рабочих мест! Что предстоит делать: Работать с графическими и текстовыми редакторами; Контролировать ассортимент и наполнение сайта. Размещать информацию на сайте и в личном кабинете поставщика. БЕЗ работы с каналом на YouTube и БЕЗ мониторинга цен! Что нам Важно в кандидатах на эту должность: Понимание специфики работы контент-отделов интернет-магазина; Желание развиваться в данном направлении; Законченное образование; Внимательность и грамотность; Умение структурировать информацию; Уверенный пользователь MS Office, Excel. Ваши преимущества: Опыт работы в Adobe Photoshop или 1С; Активность и энергичность. Что мы Вам обеспечим: Интересные задачи и уникальный опыт, наставничество; Своевременные выплаты заработной платы; Работа в стабильно развивающейся компании - гарантия занятости; Широкие возможности для профессионального роста в кратчайшие сроки; Отличный молодой коллектив, приятная атмосфера; Трудоустройство, рабочий день с 9-00 до 18-00 часов, в офисе, график 5/2; Комфортное рабочее место в одном из лучших офисов на северо-западе; Чай и кофе каждому сотруднику; уютная кухня с видом на лес. Испытательный срок - 1 месяц. Высылайте резюме с пометкой КОНТЕНТ в сопроводительном письме! Проводим только 1 интервью с руководителем. объявление не является публичной офертой ",,не требуется,Контент-менеджер (офис на Северо-Западе),,20000.0,18000.0,полный день,"Наполнение контентом,Графические редакторы,внимательность,CorelDRAW,Adobe Illustrator,Копирайтинг,Редактирование,Пользователь ПК,Работа в команде,Работа с большим объемом информации",Полная занятость,https://tyumen.hh.ru/vacancy/39418049
8,Челябинск,"7 линия, digital-агентство",,16 сентября 2020," Рассмотрим кандидатов с небольшим опытом, начинающих специалистов, желающих развиваться в этой сфере. За сотрудником будет закреплён наставник, который будет заниматься обучением и консультированием по текущим вопросам. Обязанности: Проработка семантики, минусовка и пр. Разработка и ведение рекламных кампаний в системах Яндекс.Директ и GoogleAds. Аудит кампаний, аналитика, настройка целей. Подготовка кроссканальной отчётности. Требования: Приветствуются знания и опыт работы с любыми инструментами контекстной рекламой. Опыт аналитической работы в Яндекс.Метрике, GA тоже будут очень кстати. Хорошее знание русского языка. Высокая обучаемость и умение работать в режиме многозадачности. Условия: Своевременная стабильная заработная плата с перспективой повышения. Отличный loft-офис в центре города. Корпоративные мероприятия за счёт компании. Участие в интересных (в том числе собственных) проектах студии. Дружный молодой коллектив. ","Проработка семантики, минусовка и пр.,Разработка и ведение рекламных кампаний в системах Яндекс.Директ и GoogleAds.,Аудит кампаний, аналитика, настройка целей.,Подготовка кроссканальной отчётности.",не требуется,"Младший трафик-менеджер (Я.Директ, Google Ads)",,20000.0,20000.0,полный день,"Яндекс.Директ,Работа с директ командером,Контекстная реклама,Внешний аудит контекстной рекламы,Работа с системами аналитики,Google AdWords,Яндекс.Метрика,Google Analytics,Ремаркетинг",Полная занятость,https://tyumen.hh.ru/vacancy/39265327
813,Челябинск,АМК Химико Рус,,24 сентября 2020, Обязанности: Работа в программе Битрикс 24; Ежедневно прослушивать записи звонков менеджеров по продажам и каждому звонку давать оценку по нескольким критериям. Также оценки дополнять кратким комментарием; Ежедневное распределение пропущенных звонков между менеджерами по регионам; Ежедневный отбор из разговоров менеджеров по продажам новых возражений клиентов; Ежедневное отслеживание правильности заполнения Битрикс 24 менеджерами по продажам. Постановка задач по доработке; Еженедельный отбор по заданным критериям хороших и плохих разговоров для тренера по продажам; Еженедельно обсуждение результатов с тренерами и руководителем. Требования: Уверенный пользователь ПК Скрупулёзность Внимательность Усидчивость Условия: ​​​​​​​ Работа удаленно (на дому). Молодой дружный коллектив График работы: пятидневка с 8:30 до 17:30 KPI по прослушанным звонкам Бесплатное обучение инструментам оценки. ,,не требуется,"Специалист отдела контроля качества (удаленно, Челябинск)",,20000.0,20000.0,удаленная работа,"Работа с возражениями,Навыки продаж,Обучение и развитие,1С-Битрикс,Прием и распределение телефонных звонков,Умение работать в команде,Развитие продаж",Полная занятость,https://tyumen.hh.ru/vacancy/39434584
702,Челябинск,СПАР Урал,,14 октября 2020," Обязанности: Поддержка пользователей по телефону и электронной почте. Регистрация и дальнейшее сопровождение инцидентов, жалоб, запросов в сфере ИТ. ​ Требования: Желательно профильное образование (ИТ сфера). Готовы рассматривать также студентов. Опытный пользователь ПК: Microsoft Office, Internet, Outlook и другие стандартные программы. Приветствуется опыт работы оператором в Call-центре. Коммуникабельность, стрессоустойчивость, способность разрешать конфликты, грамотная речь, обучаемость. Условия: Место работы ул. Труда, 166. График работы пятидневная рабочая неделя с 09.00 до 18.00. Заработная плата: 25000 руб. Работа на время отсутствия основного работника (декретный отпуск). Официальное трудоустройство с полным социальным пакетом. Обучение и развитие внутри компании. Возможность карьерного роста. По вакансии следует обращаться в Отдел подбора персонала: г. Челябинск, ул. Труда, д. 166, 1 этаж, каб. ""Отдел подбора персонала"" в будние дни с 09.00 до 17.00. Уважаемые кандидаты! При отправке резюме в теме письма обязательно укажите вакансию. После получения резюме мы связываемся с Вами самостоятельно в случае положительного рассмотрения. Если у Вас возникли вопросы по вакансиям, то Вы можете позвонить по указанным в объявлении телефонам. ",,не требуется,Специалист по поддержке пользователей,"Желательно профильное образование (ИТ сфера). Готовы рассматривать также студентов.,Опытный пользователь ПК: Microsoft Office, Internet, Outlook и другие стандартные программы.,Приветствуется опыт работы оператором в Call-центре.,Коммуникабельность, стрессоустойчивость, способность разрешать конфликты, грамотная речь, обучаемость.",23000.0,18000.0,полный день,"MS Outlook,Подбор персонала,Пользователь ПК,Грамотная речь,Обучение и развитие",Полная занятость,https://tyumen.hh.ru/vacancy/39357852
