,address,company,conditions,date,description,duty,experience,name,requirements,salaryMAX,salaryMIN,schedule,skills,type_of_employment,url
136,Магнитогорск,Магнитогорский металлургический комбинат,"корпоративное обучение;,регулярное повышение квалификации за счет работодателя;,официальное оформление по ТК РФ;,комфортные условия труда в современном офисе;,достойный уровень дохода, в зависимости от квалификации;,возможность профессионального и карьерного роста.",18 сентября 2020," Приглашаем специалистов в области проектного управления и информационных технологий для участия в проектах внедрения и оказания консультационных услуг в области инновационных технологий (Robotic Process Automation, ML, AI и т.п.). От кандидата требуется умение работать в команде, а также навыки организации работы команды в проектах по оказанию консультационных услуг, услуг внедрения инновационных технологии и прочих проектах. Основная обязанность - управление ИТ-проектами от планирования, до организации и сдачи в эксплуатацию. Обязанности: успешная реализация проектов ИТ, достижение результатов проекта; управление проектами (организационная часть, ресурсы, документооборот); непосредственное участие в проектах внедрения ИТ, проектах оказания услуг ИТ; организация взаимодействия команд разработчиков и консультантов; анализ основных бизнес-процессов организации (производства); разработка, корректировка и структурирование технических заданий, согласование с заказчиком; Требования: высшее образование в сфере информационных технологий, программирования, информатики или АСУ; опыт управления проектами; опыт анализа бизнес-процессов; опыт разработки технических заданий; знание общих принципов построения алгоритмов программного обеспечения; знание английского языка на уровне чтения технической и профильной документации. Условия: корпоративное обучение; регулярное повышение квалификации за счет работодателя; официальное оформление по ТК РФ; комфортные условия труда в современном офисе; достойный уровень дохода, в зависимости от квалификации; возможность профессионального и карьерного роста. Окончательный уровень заработной платы устанавливается по результатам собеседования в зависимости от опыта и квалификации. ","успешная реализация проектов ИТ, достижение результатов проекта;,управление проектами (организационная часть, ресурсы, документооборот);,непосредственное участие в проектах внедрения ИТ, проектах оказания услуг ИТ;,организация взаимодействия команд разработчиков и консультантов;,анализ основных бизнес-процессов организации (производства);,разработка, корректировка и структурирование технических заданий, согласование с заказчиком;",1–3 года,Руководитель ИТ-проектов (ММК-Информсервис),"высшее образование в сфере информационных технологий, программирования, информатики или АСУ;,опыт управления проектами;,опыт анализа бизнес-процессов;,опыт разработки технических заданий;,знание общих принципов построения алгоритмов программного обеспечения;,знание английского языка на уровне чтения технической и профильной документации.",90000.0,60000.0,полный день,,Полная занятость,https://tyumen.hh.ru/vacancy/39309818
162,Челябинск,"Варяг, Холдинг предприятий безопасности",,12 октября 2020," «ВАРЯГ» – современный, стремительно развивающийся холдинг предприятий, разрабатывающих инновационные решения в области безопасности и интернета вещей. Продуктами компании являются системы мониторинга и защиты имущества, инженерно-технические средства безопасности, услуги пультовой и физической охраны, а также образовательные услуги спецподготовки персонала. Пользователи продуктов и услуг под брендами компании - это более 25 000 клиентов на территории Уральского Федерального округа, от физических лиц и малого бизнеса до крупнейших федеральных и государственных компаний. В связи с развитием и ростом количества ИТ-проектов, приглашает на работу python-разработчика! Обязанности: разработка микросервисов с использованием фреймворков (flask, tornado); поддержание и доработка существующих микросервисов; написание документации (в том числе swagger); написание SQL-запросов, процедур для MySQL; работа с терминальными командами Ubuntu Server; обработка информации с IoT систем. Требования: опыт работы python программистом от 1 года на коммерческих проектах; уверенное знание SQL; знание основных паттернов проектирования; приветствуется знание Git. Условия: работа в крупной компании с развитой филиальной сетью; конкурентный уровень заработной платы (обсуждается индивидуально с каждым успешным кандидатом); работа в команде молодых и амбициозных специалистов; развитая корпоративная культура; внутреннее и внешнее обучение за счёт компании (тренинги, курсы, семинары, профессиональная литература); доставка сотрудников корпоративным транспортом; профессиональное развитие, возможность карьерного роста до руководителя проектов; место работы: Курчатовский район. Возможно Вы – тот‚ кого мы ищем! Высылайте нам свое резюме и мы рассмотрим его в течение 3 рабочих дней. Если Ваш опыт и пожелания соответствуют требованиям и возможностям компании - мы свяжемся с Вами по указанным в резюме контактам. "," , , , , , , , , , , , ",1–3 года,Программист Python,,90000.0,60000.0,полный день,"Python,Git,MySQL,Ubuntu,Flask",Полная занятость,https://tyumen.hh.ru/vacancy/37317309
215,Челябинск,Xpage,,12 октября 2020," Привет! Мы- Digital Agency Xpage. Уже более 17 лет мы помогаем своим клиентам получать максимум пользы от современных технологий и инструментов веб-разработки, интернет-рекламы, дизайна и автоматизации. В нашем бэкграунде проекты для крупных представителей международного бизнеса и государственных структур. Мы- современная и динамично развивающаяся команда. В связи с ростом глубины и количества проектов, мы открываем вакансию ""Менеджер IT проектов"" Что предстоит делать: Сопровождение интернет-проектов на всех этапах: контроль, анализ, подготовка, процесс создания/разработки, тестирование, запуск и сопровождение; Управлять отношениями с клиентом и его ожиданиями на протяжении всего этапа разработки проекта; Изучать специфику бизнеса клиента, бизнес-процессы и предлагать решения; Управлять проектной командой (дизайнер, верстальщик, программист, контент-менеджер); Контролировать результаты и сроки выполнения; Составлять ТЗ, вести проектную документацию, утверждать ее с клиентом и предоставлять отчеты о проделанной работе; Участвовать в улучшении качества и эффективности разработки проектов: аналитика, расчет себестоимости проектов, оптимизация бизнес-процессов, расчет KPI команды. Необходимый бэкграунд: Релевантный опыт работы (на должности менеджера интернет-проектов или аккаунт-менеджера) от 1 года; Навыки разработки и написания документации по проектам; Знание основ интернет-маркетинга; Качества командного игрока -лидера: способный к компромиссам и работе в проектной группе, но при этом самостоятельная сильная единица этой команды, умеющая брать на себя ответственность и работать на результат; Аналитическая работа; Опыт построения высокоэффективных и прозрачных коммуникаций с клиентами; Xpage — это, прежде всего, команда высококлассных профессионалов и молодых амбициозных специалистов. Это команда жизнерадостных, творческих и любознательных людей, для которых интернет — это жизнь. Мы стремимся создавать для своих сотрудников только самые комфортные условия работы и отдыха. Наши сотрудники имеют уникальную возможность повышать свою квалификацию и развивать полезные профессиональные навыки на лучших площадках. Мы даем своим сотрудникам свободу идей, творчества и самовыражения. Гарантируем трудоустройство по ТК РФ. Xpage — это большая семья, которая всегда рада принять новых людей) ",,1–3 года,Менеджер IT-проектов,,90000.0,60000.0,полный день,"Управление проектами,Разработка технических заданий,Управление интернет-проектами,Обучение и развитие,Проектный менеджмент,Лидерство,Аналитические способности,Управление персоналом,Работа в команде",Полная занятость,https://tyumen.hh.ru/vacancy/39449713
363,Челябинск,Creative,,15 октября 2020," Привет! Мы - компания Creative. Занимаемся веб и мобильной разработкой: создаем цифровое будущее компаний и стремимся стать лидерами на российском рынке. Работаем с крупными федеральными и зарубежными компаниями - Сбербанк, Альфа Банк, Банк Открытие, Газпромнефть, РБК, Utair, Московская биржа, Новостроев, Моссвет и многими другими. Команда: более 60 человек (бэкенд, фронтенд и мобильные разработчики, тестировщики, дизайнеры). Кто нам нужен: Разработчики Битрикс (middle/senior), готовые в составе талантливой команды разработки делать интересные и полезные проекты, работающие для людей. Что мы ждем от вас: опыт коммерческих проектов; глубокие знания PHP 7+, Bitrix Framework; опыт работы с MySQL / MariaDB; опыт работы с с ядром D7, с композитом; опыт работы с Git, Docker, Docker Compose, знание HTML 5, CSS 3. Будет плюсом: наличие сертификата Битрикс (Интеграция дизайна и настройка платформы). От нас: 1. Конкурентный уровень заработной платы. 2. Гибкий график (общий - с 10 до 19 часов, есть возможность подстраивать время старта и окончания рабочего дня под себя, иногда работать из дома). 3. Перспективы профессионального и карьерного роста - возможность пробовать новые стеки и стать тимлидом. 4. Внутреннее обучение в рамках СREATIVE Quality Academy: оцифровка скиллов, прохождение аттестаций и регулярное повышение грейда. 5. Большая интересная команда и лояльное руководство. 6. Активная корпоративная жизнь (пятничные встречи с интересными ребятами, поездки на конференции, корпоративные клубы шахмат, волейбола и многое другое). 7. Реферальная программа (система премирования за привлечение в компанию новых сотрудников). 8. Возможность выезжать работать в другие города с командой с компенсацией от компании. 9. Релокационный пакет для кандидатов из других городов (материальная помощь, оплата проживания на первое время и др.) ",,1–3 года,Разработчик Битрикс (Bitrix),,90000.0,60000.0,удаленная работа,"MySQL,1С-Битрикс,Git,PHP,HTML,CSS",Полная занятость,https://tyumen.hh.ru/vacancy/39316598
408,Магнитогорск,Amigoweb,,14 октября 2020," Amigoweb — распределенная команда веб-разработчиков. Наш дружный коллектив состоит из 30 специалистов. Ценим в людях профессионализм, умение работать в команде, способность обучаться. Наша команда развивается, нам доверяют всё больше интересных, крупных проектов. Поэтому в штат компании требуется Backend-разработчик на полный рабочий день, удаленно. Мы ищем кандидата, который: работал с фреймворком Laravel; знает ООП (классы, наследование, множественное наследование, интерфейсы); готов работать с API внешних систем по документации; уверенно работает с Git. Будет плюсом: умение / опыт написания тестов для своего кода; умение / опыт документирования кода (API) в swagger системах; опыт работы и знание Oracle SQL, СУБД MySQL; знания в области сетевых технологий (туннелирование, проксирование, vpn). Предлагаем: Официальное оформление в штат; возможность работать удаленно; оплачиваемый отпуск / больничный; возможность работать над крупными проектами известных брендов. Бонусы Возможность незначительно сдвигать рабочий график. Оплата сверхурочных. ",,1–3 года,Backend разработчик (Laravel / Lumen),,90000.0,65000.0,удаленная работа,"PHP,Git,ООП,Laravel",Полная занятость,https://tyumen.hh.ru/vacancy/39296226
10,Челябинск,КОНАР,,14 октября 2020," Обязанности: техническое обслуживание и ремонт сложного технологического оборудования; разработка и реализация программ модернизации оборудования; отладка режимов работы; диагностика управляющих программ. Требования: высшее техническое образование; опыт разработки программ для АСУ ТП; программирование промышленных PLC; опыт разработки программ к HMI; участие в сборе исходных данных, составление функциональных и структурных схем АСУ для выполнения требований технологического процесса; участие в разработке СУ для размещения в производство; участие в тестирование и отладке ПО. Условия: Работа на крупном стабильно развивающемся производственном предприятии.( г. Челябинск). Полное соблюдение трудового законодательства РФ (первичный и повторный медицинский осмотр за счет компании, оплата отпусков, больничных листов, оформление по ТК). Заработная плата на карту банка 2 раза в месяц, оклад + премия. ""День банков и страховых компаний"" – консультации банков-партнеров, оформление электронного полиса обязательного медицинского страхования (для сотрудников и членов семей). Медицинский центр – консультации терапевта, узких специалистов; медицинские и физиопроцедуры. Корпоративный фитнес - центр АО ""КОНАР"" на территории предприятия (фитнес, тренажерный зал, массажный кабинет.), посещения бассейна «Юбилейный» за счет компании. Организованные зоны питания, Столовые «Уральские пельмени», кафе «Пончиковая"" и ""Кофейня"". Рабочее место: Енисейская.. Доставка служебным транспортом на работу/с работы по городу, внутри территории предприятия. Организована охраняемая стоянка для сотрудников компании. Интересная корпоративная жизнь (возможность льготного посещения игр «Трактор», участие в различных спортивных мероприятиях и т.д.). * Спасибо за интерес, проявленный к вакансии. Обращаем Ваше внимание, что компания рассматривает кандидатов на конкурсной основе. В вакансии указаны минимальные требования к квалификации для данной должности. Просмотр резюме и приглашение на интервью не является готовностью сделать Вам предложение о работе. Встречи или телефонные интервью будут проведены только с кандидатами, которые в наибольшей степени соответствуют требованиям и ценностям компании. Работодатель вправе заключить трудовой договор с любым из обратившихся кандидатов. ",,3–6 лет,Инженер-программист АСУ ТП,,91000.0,65000.0,полный день,,Полная занятость,https://tyumen.hh.ru/vacancy/39810122
