,address,company,conditions,date,description,duty,experience,name,requirements,salaryMAX,salaryMIN,schedule,skills,type_of_employment,url
92,Челябинск,Агентство Бизнес и Кадры,,14 октября 2020," В связи с расширением отдела, открыта вакансия инженера -проектировщик АСУТП в инжиниринговой компании. основное направление -разработка систем промышленной автоматизации и аналитических комплексов “под ключ "". Обязанности: Проектирование шкафов управления АСУ ТП, сборка, наладка. Разработка отдельных разделов проекта согласно плану графику проекта и техническому зданию; Оформление сопроводительных документов для сдачи проектной документации; Общение с Заказчиком по деталям проекта.; Подготовка, сдача, сопровождение проектной документации в экспертизе; Участие в пусконаладочных работах. Принятие грамотных и экономически выгодных технических решений. Требования: Высшее инженерно-техническое образование. Опыт работы от 3 лет; Понимание технической документации (например: схемы комплекса технических средств, локальной вычислительной сети, питания ПТК, принципиальные электрические схемы питания асу и т.п); Навыки работы с ПК на уровне опытного пользователя; Работа в программном комплексе AutoCAD, Компас, Exсel Приветствуется навык программирования асу тп. Условия: Стабильно развивающаяся компания. офис расположен на северо-западе. своевременная выплата з/п, ""белая"", размер обсуждается индивидуально на собеседовании. Возможность профессионального развития и карьерного рост.а. ","Проектирование шкафов управления АСУ ТП, сборка, наладка.,Разработка отдельных разделов проекта согласно плану графику проекта и техническому зданию;,Оформление сопроводительных документов для сдачи проектной документации;,Общение с Заказчиком по деталям проекта.;,Подготовка, сдача, сопровождение проектной документации в экспертизе;,Участие в пусконаладочных работах.,Принятие грамотных и экономически выгодных технических решений.",1–3 года,Инженер-проектировщик АСУТП,,70000.0,50000.0,полный день,"AutoCAD,Компас,Разработка проектной документации,Компас-3D,MS Project",Полная занятость,https://tyumen.hh.ru/vacancy/37840260
223,Челябинск,Метаком-Сервис,,7 октября 2020," Обязанности: Сопровождение и конфигурирование 1 С версия 8.х; Консультация пользователей (наших сотрудников) по вопросам работы c программой 1С версия 8.х; Оптимизация базы; Разработка, доработка, донастройка различных систем учета в существующих конфигурациях 1С. Работа в том числе в режиме: «Придумал — Написал — Внедрил пользователям»; Требования: Знание конфигураций 1С 8.х; Знание различных методик обмена данными; Умение работать с обычными и управляемыми формами; Работа с нестандартными конфигурациями; Умение понимать и модифицировать чужой код; Знание мобильной платформы 1С; Знание основ складского, бухгалтерского, управленческого, бюджетирования. Условия: Работа возможна в том числе в комфортном офисе по графику (пн-пт), дружный коллектив) Стабильный оклад + премии Карьерный рост обязателен Введение в специфику работы бесплатное и обязательное ",,не требуется,Программист 1C 8,,70000.0,50000.0,полный день,"1С: Предприятие 8,1С программирование,1C: Бухгалтерия,1С: Управление предприятием",Проектная работа/разовое задание,https://tyumen.hh.ru/vacancy/39676745
228,Челябинск,Удобные Решения,,29 сентября 2020," Наша компания является разработчиком программных продуктов и мобильных приложений для сферы жилищно-коммунального хозяйства, в основе которых лежит коммуникация между жителями и управляющими компаниям. С 2018 года мы стали частью финской компании YIT. У нас два продукта: -Диспетчер 24 (функциональная CRM-система для управляющих организаций и ТСЖ, автоматизирующая работу аварийно-диспетчерской службы, клиентского отдела и колл-центр, базирующийся в Кургане); - OiCO (мобильное приложение для жителей управляющей компании, содержит необходимые сервисы для комфортной жизни). Наши клиенты – это УК и ЖКХ (B2B) и жители этих УК, конечные пользователи мобильного приложения (B2C). География нашего присутствия - 25 городов РФ: Екатеринбург, Тюмень, Курган, Казань, Москва, Санкт-Петербург, Новосибирск, Бердск, Краснодар и др. Открываем вакансию маркетолога, основной задачей которого будет интернет-продвижение продуктов компании на рынке и рост b2b аудитории: Функции: Разработка рекламных сообщений, текстов промо-материалов, статей, контента для размещения на сайте и в соц. сетях Погружение в продукт, изучение ЦА и конкурентов, формирование УТП Создание посадочных страниц в Tilda Создание презентаций для отдела продаж; Генерирование и проверка гипотез по рекламе Требования к профессиональным навыкам: Опыт решения подобных задач на b2b рынке от 2 лет Умение составлять эффективные заголовки и тексты; Опыт работы в IT сфере, понимание IT специфики будет большим преимуществом; Ваша эффективность будет измеряться качественными лидами. Наше предложение: Работа в продуктовой команде с амбициозными целями; Заработная плата в размере 50 000 - 70 000 (условия обсуждаем на собеседовании); Рассматриваем кандидатов по УрФО, в режиме удаленной работы, с условием личных встреч не менее 2 раз в месяц и сотрудничество в формате белой модели взаимодействия с самозанятыми, либо договор ГПХ). ",,1–3 года,Маркетолог (продуктовый)," , , , , , ",70000.0,50000.0,полный день,"Продвижение бренда,Написание рекламных статей,Креативность,Ориентация на клиента,Product Promotion,Анализ конкурентной среды,Оценка потребностей клиентов,Анализ рынка",Полная занятость,https://tyumen.hh.ru/vacancy/39143352
710,Челябинск,Компания maxim,,9 октября 2020," Кто мы: IT-компания, предоставляющая облачные решения в сфере такси. К нашим сервисам подключено большое количество компаний, среди которых как мелкие региональные игроки, так и компании с мировым именем, такие как сервис заказа такси «Максим». Мы — команда вне географического фактора, части которой эффективно взаимодействуют из разных точек мира. У нас 5 it-подразделений в городах РФ и 4 подразделения за рубежом. 250+ сотрудников и два десятка направлений работы в сфере IT. Чем предстоит заниматься: участвовать в разработке и поддержке проекта автоматизированной системы отчетности на основе Pentaho BI Platform; создание новых или доработка существующих отчетов (sql скрипты, отчетные формы Pentaho Reporting); выгрузка данных из БД Postgres, MSSQL (по запросам бизнес подразделений); написание сложных sql запросов. написание SQL скриптов агрегации данных для построения отчетов; оптимизация SQL запросов; сбор и анализ бизнес-требований; диагностика и устранение ошибок формирования данных в отчетах; создание, доработка и поддержка OLAP-кубов на платформе Pentaho Analysis Services Community Edition. Что ожидаем от кандидата: уверенное знание принципов построения реляционных баз + ANSI SQL; понимание основных показателей деятельности блока продаж, портфельная/продуктовая аналитика, операционная аналитика; программирование: SQL (индексы, функции, пакеты, задания, триггеры, динамический SQL). Способность работать с чужим SQL кодом; опыт составления сложных SQL-запросов (PL/SQL,TSQL); опыт разработки и понимание принципов OLAP-технологий. Что мы предлагаем: интересные задачи; дружелюбный коллектив; корпоративное обучение; поездки на it-конференции; комфортное рабочее место; компенсацию питания; ДМС; бесплатные корпоративные мероприятия (Новый Год, командные выезды и движухи); уровень заработной платы, который зависит от технических знаний и навыков (+ регулярный пересмотр, если вы растете); оформление по ТК РФ; есть программа релокации. ",,1–3 года,Разработчик отчетов,,70000.0,50000.0,полный день,"MS SQL,Olap (online analytical processing),SQL",Полная занятость,https://tyumen.hh.ru/vacancy/39183116
799,Челябинск,Интернет-агентство Dextra,"Официальное трудоустройство,,Возможность довольно гибкого графика,,Комфортабельный офис в центре с остановками и парковкой,,Возможен рост заработной платы в зависимости от опыта и компетенции.",24 сентября 2020," Прежде всего хочется чтобы верстальщик хорошо знал кроссбраузерную верстку, и умел писать аккуратный структурированный код с комментария. ОПЫТ РАБОТЫ от 2 лет. Обязательно знание Javascript, библиотек и фреймворков. Знания графических редакторов на уровне «порезать шаблон». Обязанности : Верстать адаптивные макеты (и уметь адаптировать не адаптивные). Помнить про кроссбраузерность (Progressive Enhancement, Graceful Degradation). Работать с макетами (Photoshop обязательный, Illustrator, Sketch будет только плюсом). Разрабатывать JS различной сложности (в основном не очень сложные, но если вы разбираетесь, как там внутри все устроено, знаете, что как реализуется прототипное наследование, то это тоже будет только плюсом). Интерактив и анимация элементов интерфейсов. Требования: Опыт работы, портфолио. Хорошие знания HTML5, CSS3. Владение JavaScript, опыт использования jQuery плагинов (а если будет и опыт написания, то еще лучше). Опыт применения препроцессоров (Stylus, Less, Sass) будет только плюсом. Знакомство с Gulp, PostCSS и другими современными технологиями также пойдет вам в плюс. Опыт работы в инфраструктуре компании: контроль версий (git). Условия работы: Официальное трудоустройство, Возможность довольно гибкого графика, Комфортабельный офис в центре с остановками и парковкой, Возможен рост заработной платы в зависимости от опыта и компетенции. ","Верстать адаптивные макеты (и уметь адаптировать не адаптивные).,Помнить про кроссбраузерность (Progressive Enhancement, Graceful Degradation).,Работать с макетами (Photoshop обязательный, Illustrator, Sketch будет только плюсом).,Разрабатывать JS различной сложности (в основном не очень сложные, но если вы разбираетесь, как там внутри все устроено, знаете, что как реализуется прототипное наследование, то это тоже будет только плюсом).,Интерактив и анимация элементов интерфейсов.",3–6 лет,HTML-верстальщик/front-end разработчик,"Опыт работы, портфолио.,Хорошие знания HTML5, CSS3.,Владение JavaScript, опыт использования jQuery плагинов (а если будет и опыт написания, то еще лучше).,Опыт применения препроцессоров (Stylus, Less, Sass) будет только плюсом.,Знакомство с Gulp, PostCSS и другими современными технологиями также пойдет вам в плюс.,Опыт работы в инфраструктуре компании: контроль версий (git).",70000.0,50000.0,полный день,"HTML,CSS,HTML5,CSS3,Bootstrap,Git,Java",Полная занятость,https://tyumen.hh.ru/vacancy/39440660
113,Челябинск,Велес Строй,,17 сентября 2020," В крупную, стабильную компанию на вахту в Вологодскую область срочно требуются МОНТАЖНИКИ ТТ! Обязанности: - Работа с технологическим трубопроводом; - Работа с металлоконструкциями; Требования: - Опыт работы по подготовке и сборке стыков трубопроводов технологической обвязки не менее 2 лет; - Подтверждение опыта в трудовой; - Удостоверение монтажника; - Удостоверение стропальщика желательно; - Умение читать чертежи, знать технологию, работать с инструментом; - Наличие медицинской комиссии по форме № 302н Условия: - Вахта 60/30 (можно дольше, меньше 60 дней вахту нельзя); - Оплата почасовая; - Предоставляется бесплатное проживание; - Выдается спецодежда и обувь по сезону бесплатно! - Оформление на объекте. - Прямой работодатель! ",,1–3 года,Монтажник ТТ,,75000.0,60000.0,Вахтовый метод,"Монтаж металлоконструкций,Сварочные работы,Чтение чертежей",Полная занятость,https://tyumen.hh.ru/vacancy/37701268
233,Челябинск,Ресурс Групп,"Проживание в съемных квартирах за счет предприятия,Спецодежда, инструмент предоставляется,Компенсация проезда,Фиксированная почасовая ставка, ,, стаж, соц. гарантии,Зарплата без задержек,Авансы каждые две недели выплатами на карту",8 октября 2020," Для работы вахтовым методом В ГОРОДЕ ВОРОНЕЖ приглашаются наладчики станков с Числовым Программным Управлением. Обязанности: Работа на станках С ЧПУ:(написание и корректировка программ на стойке) , карусельные группы Требования: Опыт работы на одной или нескольких перечисленных стоек Разряд 3-4, опыт не менее 2-х лет Подтверждение опыта и разряда в трудовой книжке Условия: Вахта 60/30 в г. ТУЛА Прямой работодатель Проживание в съемных квартирах за счет предприятия Спецодежда, инструмент предоставляется Компенсация проезда Фиксированная почасовая ставка, НЕ норма и НЕ сделка. Возможность выработки до 300 часов в месяц. Трудоустройство по ТК РФ , стаж, соц. гарантии Зарплата без задержек Авансы каждые две недели выплатами на карту ","Работа на станках С ЧПУ:(написание и корректировка программ на стойке),, карусельные группы",3–6 лет,Карусельщик с ЧПУ,"Опыт работы на одной или нескольких перечисленных стоек,Разряд 3-4, опыт не менее 2-х лет,Подтверждение опыта и разряда в трудовой книжке",78000.0,76000.0,Вахтовый метод,,Полная занятость,https://tyumen.hh.ru/vacancy/39703647
